Customer,WO #,Invoice #,Date,Due Date,Total,Balance,Invoice Pay Status,WO Description,Summary
100 Emerald Beach Way,1323,i1290,2026-01-14 12:00 AM,2026-02-13 12:00 AM,0.00,0.00,NON-BILLABLE,"IN-DEPTH FOR SEPTEMBER 2025/\CRCovers: All 1st floor main house air handling units, 1-Carrier 30MPW030 chiller, 1-Marley AQ493 cooling tower, 1-Trane sp",IN-DEPTH FOR SEPTEMBER 2025/\CRCompleted maintenance by Sammy. \CRCleaned all drain lines. Did not due the filters due to construction. \CR
100 Emerald Beach Way,1324,i1291,2026-01-14 12:00 AM,2026-02-13 12:00 AM,0.00,0.00,NON-BILLABLE,"IN-DEPTH A/C MAINTENANCE FOR OCTOBER 2025/\CRCovers: All 1st floor main house air handling units, 1-Carrier 30MPW030 chiller, 1-Marley AQ493 cooling tow",IN-DEPTH A/C MAINTENANCE FOR OCTOBER 2025/\CRCompleted maintenance by Sammy.\CRCleaned the drains/did not replace the filters.
100 Emerald Beach Way,1628,i1572,2026-01-13 12:00 AM,2026-02-12 12:00 AM,0.00,0.00,NON-BILLABLE,"INDEPTH A/C MAINTENANCE FOR JANUARY 2026/\CRCovers: All 1st floor main house air handling units, 1-Carrier 30MPW030 chiller, 1-Marley AQ493 cooling towe",INDEPTH A/C MAINTENANCE FOR JANUARY 2026/\CRMaintenance completed by Pablo/Gabriel.\CRCleaned tower. \CRNOTE: Lukas wants a new water pump and blower motor
100 Emerald Beach Way,1629,i1573,2026-01-14 12:00 AM,2026-02-13 12:00 AM,0.00,0.00,NON-BILLABLE,WATER TREATMENT FOR JANUARY 2026/\CRPaid service on 1/2/2026.,WATER TREATMENT FOR JANUARY 2026/\CRUnable to gain access to the property this week. Properly Manager has requested that I come back next week for servi
100 Emerald Beach Way,1630,i1574,2026-01-14 12:00 AM,2026-02-13 12:00 AM,0.00,0.00,NON-BILLABLE,"IN-DEPTH FOR A/C FOR NOVEMBER 2025/\CR2-Men 8 hrs each total of 16 hrs\CRCovers: All 1st floor main house air handling units, 1-Carrier 30MPW030 chiller,",IN-DEPTH FOR A/C FOR NOVEMBER 2025/\CRNOTE: Main entrance system is overcooling due to a faulty blower motor running all day. Need to replace blower mot
100 Emerald Beach Way,1631,i1575,2026-01-14 12:00 AM,2026-02-13 12:00 AM,0.00,0.00,NON-BILLABLE,"IN-DEPTH A/C MAINTENANCE FOR DECEMBER 2025/\CRCovers: All 1st floor main house air handling units, 1-Carrier 30MPW030 chiller, 1-Marley AQ493 cooling to",IN-DEPTH A/C MAINTENANCE FOR DECEMBER 2025/\CRDid not perform maintenance due to construction.
100 Emerald Beach Way,1632,i1576,2026-01-14 12:00 AM,2026-02-13 12:00 AM,0.00,0.00,NON-BILLABLE,WATER TREATMENT FOR NOVEMBER 2025/,WATER TREATMENT FOR NOVEMBER 2025/\CRPaid for service.
100 Emerald Beach Way,1744,i1685,2026-02-26 12:00 AM,2026-03-28 12:00 AM,36.00,36.00,OVERDUE,Paid IN-DEPTH FOR THE MONTH OF FEBRUARY 2026/\CRConf with Lukas on 02/24/2026 for 02/26/2026-ALSO CHECK THE HEATER FOR MASTER BATHROOM/\CRPaid ck #5321 on,IN-DEPTH FOR THE MONTH OF FEBRUARY 2026/\CRMaintenance completed by Gabriel/Pablo. \CRMaster bedroom-had no heat. Found a bad 60 amp fuse. Picked up 2 fro
100 Emerald Beach Way,1718,i1688,2026-02-12 12:00 AM,2026-03-14 12:00 AM,3797.57,3797.57,OVERDUE,Paid FEW UNITS-NO HEAT/\CRCalled in by Lukas\CRPaid ck #5321 on 6/15/2026 part of amount $6828.57.\CR,FEW UNITS-NO HEAT/\CRChecked two units that Lucas showed me the Cabana and the one that’s does the laundry and 1st floor south side hallway. Found both
100 Emerald Beach Way,1757,i1698,2026-02-12 12:00 AM,2026-03-14 12:00 AM,0.00,0.00,NON-BILLABLE,WATER TREATMENT FOR FEBRUARY 2026/,WATER TREATMENT FOR FEBRUARY 2026/\CRReport attached.
100 Emerald Beach Way,1760,i1703,2026-03-03 12:00 AM,2026-04-02 12:00 AM,2995.00,2995.00,OVERDUE,Paid WHOLE HOUSE DOWN/\CRPaid ck #5321 on 6/15/2026 part of amount $6828.57.\CR,WHOLE HOUSE DOWN/\CRChiller was down to thermistor reading error. Bypassed 2nd stage compressor in order to restore cooling operation at 50%. Found a br
100 Emerald Beach Way,1805,i1755,2026-02-26 12:00 AM,2026-03-28 12:00 AM,0.00,0.00,NON-BILLABLE,CAP REPORT-\CRWants a copy of the cap report. \CR\CR,CAP REPORT/\CRHanded report to Lukas.\CR
100 Emerald Beach Way,1919,i1834,2026-03-25 12:00 AM,2026-04-24 12:00 AM,0.00,0.00,NON-BILLABLE,INDEPTH A/C MAINTENANCE FOR MARCH 2026/\CR,"INDEPTH A/C MAINTENANCE FOR MARCH 2026/\CRMaintenance completed by Gabriel/Pablo.\CRCleaned drain pans, cleared drains, changed filters and checked electr"
100 Emerald Beach Way,1934,i1849,2026-03-24 12:00 AM,2026-04-23 12:00 AM,0.00,0.00,NON-BILLABLE,WATER TREATMENT FOR MARCH 2026/\CR,WATER TREATMENT FOR MARCH 2026/\CRNote: Towers - All levels good and equipment in proper working order. Continue as is.
100 Emerald Beach Way,2012,i1933,2026-04-14 12:00 AM,2026-05-14 12:00 AM,0.00,0.00,NON-BILLABLE,PINK ROOM AREA-NOT COOLING/\CRLukas placed the call.\CRNo charge per Rob.,"PINK ROOM AREA-NOT COOLING/\CRPink room off on flow switch, vacuum water out and cleaned drain line.\CRAlso, living room unit was off, due to a loose wire"
100 Emerald Beach Way,2042,i1948,2026-04-23 12:00 AM,2026-05-23 12:00 AM,0.00,0.00,NON-BILLABLE,IN-DEPTH A/C MAINTENANCE FOR APRIL 2026/\CR,"IN-DEPTH A/C MAINTENANCE FOR APRIL 2026/\CRMaintenance completed by Gabriel/Pablo. \CRCleared drain lines. cleaned drain pans, changed filters, and checke"
100 Emerald Beach Way,2119,i2023,2026-05-05 12:00 AM,2026-06-04 12:00 AM,0.00,0.00,NON-BILLABLE,WATER TREATMENT FOR APRIL 2026/\CR,WATER TREATMENT FOR APRIL 2026/\CRTowers - All levels within acceptable ranges. No changes made at this time.
100 Emerald Beach Way,2171,i2062,2026-06-12 12:00 AM,2026-07-12 12:00 AM,0.00,0.00,NON-BILLABLE,"IN-DEPTH A/C MAINTNEANCE FOR MAY 2026/\CRCovers: All 1st floor main house air handling units, 1-Carrier 30MPW030 chiller, 1-Marley AQ493 cooling tower,",IN-DEPTH A/C MAINTNEANCE FOR MAY 2026/\CR5/28-need to reschedule for next week.\CRCompleted by Gabriel. \CR6/12/2026-next maintenance- need 1-A110 belt for
100 Emerald Beach Way,2196,i2086,2026-05-22 12:00 AM,2026-06-21 12:00 AM,0.00,0.00,NON-BILLABLE,WATER TREATMENT FOR COOLING TOWERS AND CHILLERS FOR MAY 2026/\CR,WATER TREATMENT FOR COOLING TOWERS AND CHILLERS FOR MAY 2026/\CRTower: levels are within acceptable ranges. Water temperatures are slightly elevated but
100 Emerald Beach Way,2406,i2285,2026-07-06 12:00 AM,2026-08-05 12:00 AM,378.00,378.00,DUE,WHOLE HOUSE DOWN-A/C NO COOL/,WHOLE HOUSE DOWN-A/C NO COOL/\CR1.- checked and found the chiller had a alarm code T052 and the CU2 breaker was off. Reset the alarm code and turned on
1141,1981,i1934,2026-04-13 12:00 AM,2026-05-13 12:00 AM,0.00,0.00,NON-BILLABLE,FIRE PLACE AREA-UNIT NOT WORKING-HAS 2 ERROR CODES E250 AND 292 AND ALSO LOOK AT UNIT THAT SERVICES SW BEDROOM AND GAME ROOM AREA-NOT WORKING/,"FIRE PLACE AREA-UNIT NOT WORKING AND SW BEDROOM/GAME ROOM AREA-NOT WORKING/\CRChecked system, E292 in AHU. System needs a new blower motor. \CRM/N CBA38MV"
1141,2058,i1966,2026-04-30 12:00 AM,2026-05-30 12:00 AM,4148.00,4148.00,OVERDUE,Paid REPLACE 3 CONDENSER COILS/$4148.00\CRReplaced blower motor for lounge area a/c.  Once operational found system was void of refrigerant. Performed d,REPLACE 3 CONDENSER COILS/\CRReplaced all three coils.
1141,2106,i2039,2026-05-01 12:00 AM,2026-05-31 12:00 AM,0.00,0.00,NON-BILLABLE,2 UNITS WE REPLACED THE COND COILS-ARE NOT WORKING/\CRNo charge per Rob.,"2 UNITS WE REPLACED THE COND COILS-ARE NOT WORKING/\CRFound unit overcharged. Adjusted refrigerant. Checked operation, all working normal. \CR"
1236 S Ocean Blvd-Thornton,2003,i1921,2026-04-23 12:00 AM,2026-05-23 12:00 AM,3683.00,3683.00,OVERDUE,Paid DISCONNECT OFFICE A/C UNIT/\CRPaid ACH on 07/08/2026-NOTE: check bounced---Paid ck #214148 on 7/2/2026,"DISCONNECT OFFICE A/C UNIT/\CRDisconnect private office a/c system and duct work, removed from roof. Sealed up ducts below roof deck. Reinstalled roofin"
1236 S Ocean Blvd-Thornton,2100,i2004,2026-06-01 12:00 AM,2026-07-01 12:00 AM,9191.00,9191.00,OVERDUE,CONTINUATION OF JOB FOR MAY 2026/,CONTINUATION OF JOB/\CRLabor and material required for duct modifications of exhaust fans for roofing contractor.
1236 S Ocean Blvd-Thornton,2235,i2125,2026-06-12 12:00 AM,2026-07-12 12:00 AM,3585.00,3585.00,OVERDUE,ACTIVITY FOR JUNE FROM 6/1-6/17/2026\CRSent bill on 6/23/2026 to Jay G.,ACTIVITY FOR JUNE FROM 6/1-6/17/2026/\CRContinued reroof project modified exhaust ducting for several fans.
6767 N Ocean Blvd.,1694,i1642,2026-01-26 12:00 AM,2026-02-25 12:00 AM,0.00,0.00,NON-BILLABLE,UNIT #11- GUEST BEDROOM AREA-COND MAKING NOISE/CUST TURNED UNIT OFF/,"UNIT #11- GUEST BEDROOM AREA-COND MAKING NOISE/\CRChecked customer concerns, condenser unit 1, condenser fan motor-bad bearing causing loud noise. We ne"
6767 N Ocean Blvd.,1620,i1644,2026-01-07 12:00 AM,2026-02-06 12:00 AM,178.00,178.00,OVERDUE,Paid UNIT #15-MASTER BEDROOM AREA-NO HEAT/\CRMarilyn placed the call.\CRPaid ck #8616 on 02/10/2026,UNIT #15-MASTER BEDROOM AREA-NO HEAT/\CR1/2/26\CRFound relay to heat strip not closing. Broke loose for now. Will order new relay.\CR1/7/26\CRReplace heater r
6767 N Ocean Blvd.,1728,i1672,2026-02-27 12:00 AM,2026-03-29 12:00 AM,333.00,333.00,OVERDUE,Paid INDEPTH A/C MAINTENANCE FOR FEBRUARY 2026/\CRPaid ck #8666 on 03/31/2026.\CR,INDEPTH A/C MAINTENANCE FOR FEBRUARY 2026/\CRMaintenance completed. \CRFound during maintenance. See detail below. \CR**#14-Replaced capacitors in both outd
6767 N Ocean Blvd.,1732,i1675,2026-02-05 12:00 AM,2026-03-07 12:00 AM,7649.00,7649.00,OVERDUE,"Paid HOUSE-11\CRINSTALL 1- Lennox 1.5ton air conditioning system. Rated at a 16.0 SEER2 @ 18,000 BTU/hr.\CR(ML14KC1-018 condensing unit, CBK47-018 air han",INSTALLED 1- Lennox 1.5ton air conditioning system for guest bedroom area. Started up system and working normal at this time.
6767 N Ocean Blvd.,1817,i1753,2026-02-27 12:00 AM,2026-03-29 12:00 AM,705.36,705.36,OVERDUE,"Paid VILLA-#9-BEDROOM AREA CU-#3/$705.36\CRNeed to replace warranty condenser coil that is leaking, found during the maintenance.\CRPaid ck #8661 on 03/23","VILLA-#9-BEDROOM AREA CU-#3\CRReplaced warranty condenser coil. Checked system operation, all working normal at this time."
6767 N Ocean Blvd.,1764,i1770,2026-02-13 12:00 AM,2026-03-15 12:00 AM,0.00,0.00,NON-BILLABLE,VILLA #11-THERMOSTAT BLANK/\CRWarranty call.,VILLA #11-THERMOSTAT BLANK/\CR1/4 TURN HAND VALVE LEFT CLOSED AFTER INSTALL. UNIT WENT OFF ON FLOAT SWITCH. OPENED VALVE DRAIN LINE FLOWED OUT UNIT BACK
6767 N Ocean Blvd.,1914,i1829,2026-03-20 12:00 AM,2026-04-19 12:00 AM,12993.00,12993.00,OVERDUE,"Paid HOUSE #13/\CRLIVING ROOM INSTALL 1 – Lennox Ultra efficiency variable 3-ton air conditioning system w/ heat.  Rated 19SEER 35,000 BTU/hr.\CR(EL18KCV-",HOUSE #13/ Installed 3-ton Split System for Living Room Area. Started up and charged system running normal at this time.
6767 N Ocean Blvd.,1879,i1845,2026-03-13 12:00 AM,2026-04-12 12:00 AM,0.00,0.00,NON-BILLABLE,HOUSE #15-NOT COOLING/NORTHEND-71 DEG/CENTER 75 DEG/SOUTH MASTER 72 DEG/\CRNORTHEND-EXTRA COLD/\CRNo charge.,HOUSE #15-NOT COOLING/NORTHEND-71 DEG/CENTER 75 DEG/SOUTH MASTER 72 DEG/\CRNORTHEND-EXTRA COLD/\CR3/12-Found grandchildren had thermostat set at 68 deg. N
6767 N Ocean Blvd.,2034,i1943,2026-04-17 12:00 AM,2026-05-17 12:00 AM,0.00,0.00,NON-BILLABLE,HOUSE #13-PINK ROOM-BY LAUNDRY AREA-ONLY COOLING THE FRONT SIDE AND NEW A/C NOT READING TEMP/\CRLori placed service call via email.  \CRNo charge new inst,HOUSE #13-PINK ROOM-BY LAUNDRY AREA-ONLY COOLING THE FRONT SIDE AND NEW A/C NOT READING TEMP/\CR04/17/2026\CRChecked customer's concern. All system are wo
6767 N Ocean Blvd.,2066,i1972,2026-04-28 12:00 AM,2026-05-28 12:00 AM,766.00,766.00,OVERDUE,"Paid HOUSE #15-SOUTH END AREA-MASTER BEDROOM/\CRNeed to replace warranty condenser coil, drier and recharge system to restore cooling for this area.\CRPai","HOUSE #15-SOUTH END AREA-MASTER BEDROOM/\CRReplaced warranty condenser coil for master bedroom. Checked operation, all working normal at this time."
6767 N Ocean Blvd.,2079,i1979,2026-05-11 12:00 AM,2026-06-10 12:00 AM,0.00,0.00,NON-BILLABLE,FILTER CHANGE FOR MAY 2026/\CR,"FILTER CHANGE FOR MAY 2026/\CRMaintenance completed by Gabriel/Pablo.\CRCleared drain lines, cleaned drain pans, changed filters, and checked all electric"
6767 N Ocean Blvd.,2050,i1985,2026-04-30 12:00 AM,2026-05-30 12:00 AM,0.00,0.00,NON-BILLABLE,HOUSE #15-NORTHEND-NEED TO CHECK UNIT IS WORKING/,HOUSE #15-NORTHEND-NEED TO CHECK UNIT IS WORKING/ \CRUnit is cooling well with a TD of 19 everything looks good and nothing out of the ordinary.
6767 N Ocean Blvd.,2059,i1987,2026-04-27 12:00 AM,2026-05-27 12:00 AM,0.00,0.00,NON-BILLABLE,HOUSE #15-SOUTH END AREA-MASTER BEDROOM-NOT COOLING/,HOUSE #15-SOUTH END AREA-MASTER BEDROOM-NOT COOLING/\CRUpon arrival found thermostat was calling for 73 but it was 77. Checked air handler and it had go
6767 N Ocean Blvd.,2163,i2085,2026-05-18 12:00 AM,2026-06-17 12:00 AM,0.00,0.00,NON-BILLABLE,HOUSE #5-A/C NOT WORKING/\CRLori called it in/Housekeeper there and said it was very warm.,"HOUSE #5-A/C NOT WORKING/\CR#5 system off on flow switch, emergency pan full of water. Vacuumed water out. System is working properly at this time. \CR"
6767 N Ocean Blvd.,2167,i2140,2026-05-22 12:00 AM,2026-06-21 12:00 AM,0.00,0.00,NON-BILLABLE,HOUSE #13-NEED TO REPLACE DAMPER MODULE/\CRThis was found during maintenance. See work order #2079\CRNo charge per Robert/under warranty.,"HOUSE #13-REPLACED DAMPER MODULE/\CR05/18/2026\CR#13 remove damper control.\CR05/22/2026\CRReplaced damper module, all the zones are working properly."
6767 N Ocean Blvd.,2307,i2190,2026-06-16 12:00 AM,2026-07-16 12:00 AM,0.00,0.00,NON-BILLABLE,"HOUSE #12-A/C SET FOR 88 AND READING 77, ALSO FOUND THE FAN ON ""ON"" INSTEAD OF ""AUTO""/\CRLori placed the call.\CR\CR","HOUSE #12-A/C SET FOR 88 AND READING 77, ALSO FOUND THE FAN ON ""ON"" INSTEAD OF ""AUTO""/\CRChecked thermostat and found that the thermostat had a programm"
6767 N Ocean Blvd. - 1010,2002,i1923,2026-04-09 12:00 AM,2026-05-09 12:00 AM,320.01,320.01,OVERDUE,Paid HOUSE #9-MASTER BEDROOM AREA-TSTAT NOT WORKING/\CRLori placed the call.\CRPaid ck #8685 on 04/23/2026.,"HOUSE #9-MASTER BEDROOM AREA-TSTAT NOT WORKING/\CRReplaced bad thermostat, with a T6 Pro. Set it as non-programable. System is running and cooling at th"
Abreu Wanda,2296,i2181,2026-06-13 12:00 AM,2026-07-13 12:00 AM,100.00,100.00,DUE,A/C-NOT COOLING/\CR,"A/C-NOT COOLING/\CRFound the capacitor weak and swap it out, unit is working at this time."
"""Aleksiejuk, Lukasz""",2153,i2061,2026-05-19 12:00 AM,2026-06-18 12:00 AM,250.00,250.00,OVERDUE,2-UNITS-NOT COOLING ALSO THEY WANT THE UNITS CLEANED/,"2-UNITS-NOT COOLING ALSO THEY WANT THE UNITS CLEANED/\CR05/14/2026-Checked both systems, main house a/c was completely frozen. Left the system off with"
"""Aleksiejuk, Lukasz""",2239,i2118,2026-06-01 12:00 AM,2026-07-01 12:00 AM,0.00,0.00,NON-BILLABLE,INDEPTH A/C MAINTENANCE FOR MAY 2026/\CRThis was the 1st maintenance/had to create due to setting up the contract in a different month.,"INDEPTH A/C MAINTENANCE FOR MAY 2026/\CRMaintenance completed by Gabriel. \CRCleared the drain lines, cleaned the drain pans, changed filters and checked"
"""Aleksiejuk, Lukasz""",2243,i2122,2026-06-02 12:00 AM,2026-07-02 12:00 AM,1100.00,1100.00,OVERDUE,Planned Service Agreement Yearly Invoice. \CR3 a/c systems \CR,Planned Service Agreement Yearly Invoice. \CR3 a/c systems \CR
"""Aleksiejuk, Lukasz & Marta""",1849,i1780,2026-03-05 12:00 AM,2026-04-04 12:00 AM,1822.55,0.00,PAID,"INSTALLATION DETAILS 1- Lennox 2ton single stage a/c system w/ 4kw electric heat. Rated at a 16.0 SEER2 @ 23,800 BTU/hr. \CRRemove & dispose of the exis",Installed 2-ton split system for Master Bedroom and started up system cooling normal at this time.
"""Aleksiejuk, Lukasz & Marta""",2159,i2060,2026-05-19 12:00 AM,2026-06-18 12:00 AM,0.00,0.00,NON-BILLABLE,NEW UNIT NOT HOLDING PROPER TEMPERATURE/\CRNo charge per Robert.,"NEW UNIT NOT HOLDING PROPER TEMPERATURE/\CR5/19/2026\CRSystem is working well with 20 degrees TD. the problem is the thermostat, it has 4 degrees differen"
Allisons Beach House LLC,2052,i2198,2026-06-18 12:00 AM,2026-07-18 12:00 AM,397.60,397.60,DUE,Paid PERFORM A/C MAINTENANCE/\CRPaid ck #287 on 06/26/2026.,"PERFORM A/C MAINTENANCE/ \CRMaintenance completed. Vacuumed drain line, put pan tabs, and checked condenser. Found that the condenser coil is leaking, y"
"""Allyn, William""",2194,i2096,2026-05-27 12:00 AM,2026-06-26 12:00 AM,15168.00,15168.00,OVERDUE,"Paid INSTALLATION OF COMPLETE SYSTEM, 2 THERMOSTATS AND 1 REME HALO/\CRPaid ck#695 on 5/27/2026 Paid in Full. Processed ck on 6/3/2026","INSTALLATION OF COMPLETE SYSTEM, 2 THERMOSTATS AND 1 REME HALO"
"""Allyn, William""",2409,i2281,2026-07-06 12:00 AM,2026-08-05 12:00 AM,95.00,95.00,DUE,Paid MASTER BEDROOM-NOT COOLING/\CRPaid by cc on 7/7/2026   CC: 3717 006 77333 003 Exp: 11/27 Code: 9167 same billing address \CR,"MASTER BEDROOM-NOT COOLING/\CRFond drain line was draining slowly, causing the over flow switch to trip. Purged the drain line, added chemical solvent,"
"""Ananos, Barbara""",1861,i1846,2026-03-12 12:00 AM,2026-04-11 12:00 AM,0.00,0.00,NON-BILLABLE,MAIN A/C- Need A/C Serviced--Bring 8ft ladder\CRNo charge per Darryl on 03/23/2026.,"PREVENTATIVE MAINTENANCE/\CRMaintenance completed by Pablo. \CRCompleted maintenance, vacuumed drain line, changed filters, checked condenser, wash conden"
"""Ananos, Mark""",1685,i1635,2026-02-18 12:00 AM,2026-03-20 12:00 AM,2939.35,2939.35,OVERDUE,Paid GOLF CAR GARAGE AREA/\CRInstallation of 1-Ton Daikin Mini Split System for this area including electrical work.\CRPaid ck #27631 on 5/4/2026 part of,"GOLF CAR GARAGE-Installed 1-ton Mini Split system for this area, started up system, and charged unit. System running normal at this time."
"""Ananos, Mark""",1686,i1641,2026-02-16 12:00 AM,2026-03-18 12:00 AM,1056.75,1056.75,OVERDUE,Paid MAINTENANCE ON 2 UNITS AND REPLACE UV BULBS AND 1 NEW UV POWER HEAD/\CRPaid ck #27631 on 5/4/2026 part of amount $4151.06.,MAINTENANCE ON 2 UNITS AND REPLACE UV BULBS AND 1 NEW UV POWER HEAD/\CRMaintenance completed. Replaced 2 Remi-Halo cells. Used Floxtreme to clean/unclog
"""Bachmann, Eviejoy & Chris""",2084,i1986,2026-05-19 12:00 AM,2026-06-18 12:00 AM,25273.00,25273.00,OVERDUE,"Paid A/C  INSTALLATION FOR THE RESIDENCE AND GARAGE AREA/ \CR1- Lennox 5ton variable output air conditioning system.  Rated at 19.0 SEER2 57,000 BTU/hr.",A/C  INSTALLATION FOR THE RESIDENCE AND GARxAGE AREA/ d6vcttb vs
"""Bachmann, Eviejoy & Chris""",2187,i2070,2026-05-22 12:00 AM,2026-06-21 12:00 AM,375.00,375.00,OVERDUE,Paid REME HALO/$375.00 \CRRe-Install existing Reme Halo w/new bulb and transformer in main house unit.\CRPaid ck #828 on 05/26/2026,REME HALO/\CRRe-Install existing Reme Halo w/new bulb and transformer in main house unit.\CR
"""Ballenisles CC-Cult, Mem Lge, Rac Cntr""",1613,i1560,2026-01-01 12:00 AM,2026-01-31 12:00 AM,550.00,550.00,OVERDUE,"Paid RSC Service Agreement monthly invoice.\CRCultural Center, Member Lounge, and Racquet Shop\CRPaid ACH on 01/9/2026 part of amount of $11070.00\CR","RSC Service Agreement monthly invoice.\CRCultural Center, Member Lounge, and Racquet Shop\CR"
"""Ballenisles CC-Cult, Mem Lge, Rac Cntr""",1706,i1654,2026-02-02 12:00 AM,2026-03-04 12:00 AM,550.00,550.00,OVERDUE,"Paid RSC Service Agreement monthly invoice.\CRCultural Center, Member Lounge, and Racquet Shop\CRPaid ACH on 2/12/2026 part of amount $60778.50\CR","RSC Service Agreement monthly invoice.\CRCultural Center, Member Lounge, and Racquet Shop\CR"
"""Ballenisles CC-Cult, Mem Lge, Rac Cntr""",1729,i1673,2026-02-04 12:00 AM,2026-03-06 12:00 AM,0.00,0.00,NON-BILLABLE,"INDEPTH A/C MAINTENANCE FOR JANUARY 2026/\CRNote: need to verify how many 16x25x1?\CRJAN, MAR, MAY, JUL, SEP,  AND NOV \CRIn-depth Service Including Filters","INDEPTH A/C MAINTENANCE FOR JANUARY 2026/\CRMaintenance completed by Sammy/Robert. \CRCleared drain lines, clean drain pans, changed filters and checked a"
"""Ballenisles CC-Cult, Mem Lge, Rac Cntr""",1826,i1761,2026-03-02 12:00 AM,2026-04-01 12:00 AM,550.00,550.00,OVERDUE,"Paid RSC Service Agreement monthly invoice.\CRCultural Center, Member Lounge, and Racquet Shop\CRPaid ACH on 03/10/2026 part of amount $11070.00. \CR","RSC Service Agreement monthly invoice.\CRCultural Center, Member Lounge, and Racquet Shop\CR"
"""Ballenisles CC-Cult, Mem Lge, Rac Cntr""",1839,i1774,2026-03-09 12:00 AM,2026-04-08 12:00 AM,0.00,0.00,NON-BILLABLE,"Filters are in the shop. \CRINDEPTH A/C MAINTENANCE FOR MARCH 2026/\CRNote: need to verify how many 16x25x1?\CRJAN, MAR, MAY, JUL, SEP,  AND NOV \CRIn-depth S","INDEPTH A/C MAINTENANCE FOR MARCH 2026/\CRMaintenance completed by Pablo.\CRCleared drain lines, cleaned drain pans, changed filters, and checked all elec"
"""Ballenisles CC-Cult, Mem Lge, Rac Cntr""",1970,i1894,2026-04-01 12:00 AM,2026-05-01 12:00 AM,550.00,550.00,OVERDUE,"Paid RSC Service Agreement monthly invoice.\CRCultural Center, Member Lounge, and Racquet Shop\CRPaid ACH on 04/03/2026 part of amount $19475.50.\CR","RSC Service Agreement monthly invoice.\CRCultural Center, Member Lounge, and Racquet Shop\CR"
"""Ballenisles CC-Cult, Mem Lge, Rac Cntr""",2086,i1990,2026-05-01 12:00 AM,2026-05-31 12:00 AM,550.00,550.00,OVERDUE,"Paid RSC Service Agreement monthly invoice.\CRCultural Center, Member Lounge, and Racquet Shop\CRPaid ACH on 5/8/2026 part of $18381.00.","RSC Service Agreement monthly invoice.\CRCultural Center, Member Lounge, and Racquet Shop\CR"
"""Ballenisles CC-Cult, Mem Lge, Rac Cntr""",2108,i2008,2026-05-05 12:00 AM,2026-06-04 12:00 AM,0.00,0.00,NON-BILLABLE,"INDEPTH A/C MAINTENANCE FOR MAY 2026/ \CRNote: need to verify how many 16x25x1?\CRJAN, MAR, MAY, JUL, SEP,  AND NOV \CRIn-depth Service Including Filters 12","INDEPTH A/C MAINTENANCE FOR MAY 2026/\CRMaintenance completed by Robert/Sammy.\CRCleared drains, cleaned drain pans, changed filters, and checked all elec"
"""Ballenisles CC-Cult, Mem Lge, Rac Cntr""",2123,i2032,2026-05-06 12:00 AM,2026-06-05 12:00 AM,0.00,0.00,NON-BILLABLE,RACQUET'S ICE DISPENSER-CONTSTANTLY DRIPPING WATER/\CRRob emailed service call.,"RACQUET'S ICE DISPENSER-CONTSTANTLY DRIPPING WATER/\CRDrain line on the ice machine bin needed to be cleared. Drain line under counter, also needed to b"
"""Ballenisles CC-Cult, Mem Lge, Rac Cntr""",2230,i2115,2026-06-01 12:00 AM,2026-07-01 12:00 AM,550.00,550.00,OVERDUE,"Paid RSC Service Agreement monthly invoice.\CRCultural Center, Member Lounge, and Racquet Shop\CRPaid ACH on 6/9/2026 part of amount $13857.22. \CR","RSC Service Agreement monthly invoice.\CRCultural Center, Member Lounge, and Racquet Shop\CR"
"""Ballenisles CC-Cult, Mem Lge, Rac Cntr""",2383,i2242,2026-07-01 12:00 AM,2026-07-31 12:00 AM,550.00,550.00,DUE,"Paid RSC Service Agreement monthly invoice.\CRCultural Center, Member Lounge, and Racquet Shop\CRPaid ACH on 7/9/2026 part of amount $14143.25.","RSC Service Agreement monthly invoice.\CRCultural Center, Member Lounge, and Racquet Shop\CR"
"""Ballenisles CC-Cult, Mem Lge, Rac Cntr""",2401,i2263,2026-07-08 12:00 AM,2026-08-07 12:00 AM,0.00,0.00,NON-BILLABLE,"Note: need to verify how many 16x25x1?\CRINDEPTH A/C MAINTENANCE FOR JULY 2026/\CRJAN, MAR, MAY, JUL, SEP,  AND NOV \CRIn-depth Service Including Filters 12",INDEPTH A/C MAINTENANCE FOR JULY 2026/\CRRaquet and lounge done.
"""Ballenisles CC-SE Crse, Golf Lrn/Resrms""",1610,i1557,2026-01-01 12:00 AM,2026-01-31 12:00 AM,400.00,400.00,OVERDUE,"Paid RSC Service Agreement Monthly invoice. \CRSE Course, Golf Learning Center/Restrooms.\CRPaid ACH on 01/9/2026 part of amount of $11070.00","RSC Service Agreement Monthly invoice. \CRSE Course, Golf Learning Center/Restrooms."
"""Ballenisles CC-SE Crse, Golf Lrn/Resrms""",1707,i1655,2026-02-02 12:00 AM,2026-03-04 12:00 AM,400.00,400.00,OVERDUE,"Paid RSC Service Agreement Monthly invoice. \CRSE Course, Golf Learning Center/Restrooms.\CRPaid ACH on 2/12/2026 part of amount $60778.50","RSC Service Agreement Monthly invoice. \CRSE Course, Golf Learning Center/Restrooms."
"""Ballenisles CC-SE Crse, Golf Lrn/Resrms""",1827,i1762,2026-03-02 12:00 AM,2026-04-01 12:00 AM,400.00,400.00,OVERDUE,"Paid RSC Service Agreement Monthly invoice. \CRSE Course, Golf Learning Center/Restrooms.\CRPaid ACH on 03/10/2026 part of amount $11070.00.","RSC Service Agreement Monthly invoice. \CRSE Course, Golf Learning Center/Restrooms."
"""Ballenisles CC-SE Crse, Golf Lrn/Resrms""",1855,i1786,2026-03-06 12:00 AM,2026-04-05 12:00 AM,0.00,0.00,NON-BILLABLE,Filters are here in the shop \CRINDEPTH A/C MAINTENANCE FOR MARCH 2026/\CRIn-depth Service Including Filters 12 hrs,"INDEPTH A/C MAINTENANCE FOR MARCH 2026/\CRMaintenance completed by Pablo. \CRCleared drain line, cleaned drain pans, changed filters and checked all elect"
"""Ballenisles CC-SE Crse, Golf Lrn/Resrms""",1967,i1891,2026-04-01 12:00 AM,2026-05-01 12:00 AM,400.00,400.00,OVERDUE,"Paid RSC Service Agreement Monthly invoice. \CRSE Course, Golf Learning Center/Restrooms.\CRPaid ACH on 04/03/2026 part of amount $19475.50.","RSC Service Agreement Monthly invoice. \CRSE Course, Golf Learning Center/Restrooms."
"""Ballenisles CC-SE Crse, Golf Lrn/Resrms""",2088,i1992,2026-05-01 12:00 AM,2026-05-31 12:00 AM,400.00,400.00,OVERDUE,"Paid RSC Service Agreement Monthly invoice. \CRSE Course, Golf Learning Center/Restrooms.\CRPaid ACH on 5/8/2026 part of $18381.00.","RSC Service Agreement Monthly invoice. \CRSE Course, Golf Learning Center/Restrooms."
"""Ballenisles CC-SE Crse, Golf Lrn/Resrms""",2223,i2108,2026-06-01 12:00 AM,2026-07-01 12:00 AM,400.00,400.00,OVERDUE,"Paid RSC Service Agreement Monthly invoice. \CRSE Course, Golf Learning Center/Restrooms.\CRPaid ACH on 6/9/2026 part of amount $13857.22. \CR","RSC Service Agreement Monthly invoice. \CRSE Course, Golf Learning Center/Restrooms."
"""Ballenisles CC-SE Crse, Golf Lrn/Resrms""",2313,i2185,2026-06-17 12:00 AM,2026-07-17 12:00 AM,0.00,0.00,NON-BILLABLE,FILTER CHANGE FOR JUNE 2026/\CRFilter Change Service,FILTER CHANGE FOR JUNE 2026/\CRMaintenance completed by Gabriel. \CRFilter change completed.
