Customer,WO #,Invoice #,Date,Due Date,Total,Balance,Invoice Pay Status,WO Description,Summary
McArthur Golf Club,1711,i1659,2026-02-02 12:00 AM,2026-03-04 12:00 AM,2940.00,2940.00,OVERDUE,Paid Labor Maintenance Agreement monthly invoice.\CRPaid ck#18756 on 02/10/2026,Labor Maintenance Agreement monthly invoice.
McArthur Golf Club,1716,i1676,2026-02-04 12:00 AM,2026-03-06 12:00 AM,0.00,0.00,NON-BILLABLE,DINING AREA-NO HEAT/,DINING AREA-NO HEAT/\CR2/2\CRFound heat not wired. Wired for operation now. Trane needs to set up controller for operation. Carlos to get with Trane.\CR2/4\CR
McArthur Golf Club,1743,i1683,2026-02-10 12:00 AM,2026-03-12 12:00 AM,0.00,0.00,NON-BILLABLE,FILTER CHANGE FOR FEBRUARY 2026/\CRFilter Change Service,"FILTER CHANGE FOR FEBRUARY 2026/\CRMaintenance completed by Sammy/Robert.\CRCleared all drains, cleaned all pans, changed filters, and checked all electri"
McArthur Golf Club,1791,i1729,2026-02-20 12:00 AM,2026-03-22 12:00 AM,0.00,0.00,NON-BILLABLE,OUTSIDE UNIT-NOT WORKING/\CR,"OUTSIDE UNIT-NOT WORKING/\CROA unit-condenser will not start. Found both time delays bad, jump out one time delay to get unit running. We'll need to ret"
McArthur Golf Club,1799,i1738,2026-02-25 12:00 AM,2026-03-27 12:00 AM,186.42,186.42,OVERDUE,LARGE A/C UNIT-NOT COOLING AND OUTSIDE AIR UNIT-NOT WORKING/,"LARGE A/C UNIT-NOT COOLING AND OUTSIDE AIR UNIT-NOT WORKING/\CRJumped control unit, runs but will return on Wednesday when it warms up to troubleshoot f"
McArthur Golf Club,1814,i1750,2026-03-03 12:00 AM,2026-04-02 12:00 AM,2588.00,2588.00,OVERDUE,AHU-#1/$2588.00 \CRNeed to replace both TXV's & Core Driers to restore cooling operation to 100%.,"AHU-#1/\CRReplaced both TXV's and core driers. Checked operation, all working normal at this time."
McArthur Golf Club,1822,i1757,2026-03-02 12:00 AM,2026-04-01 12:00 AM,2940.00,2940.00,OVERDUE,Paid Labor Maintenance Agreement monthly invoice.\CRPaid ck #19003 on 03/23/2026.,Labor Maintenance Agreement monthly invoice.
McArthur Golf Club,1860,i1792,2026-03-16 12:00 AM,2026-04-15 12:00 AM,0.00,0.00,NON-BILLABLE,INDEPTH A/C MAINTENANCE FOR MARCH 2026/\CRIn-depth Service Including Filters,"INDEPTH A/C MAINTENANCE FOR MARCH 2026/\CRMaintenance completed by Sammy/Robert. \CRCleared drain lines, cleaned drain pans, changed filters and checked a"
McArthur Golf Club,1862,i1798,2026-03-10 12:00 AM,2026-04-09 12:00 AM,465.00,465.00,OVERDUE,Paid BIG UNIT-NOT COOLING AND THE UNIT OVER THE COPY MACHINE-LEAKING WATER/\CRPaid ck #19083 on 04/08/2026 part of amount $2436.20.\CR,BIG UNIT-NOT COOLING AND THE UNIT OVER THE COPY MACHINE-LEAKING WATER/\CR03/06/2026-Found Trane tracer system not calling for cooling. Spoke with Trane
McArthur Golf Club,1881,i1817,2026-03-13 12:00 AM,2026-04-12 12:00 AM,0.00,0.00,NON-BILLABLE,TO MEET WITH TRANE-PER CARLOS REQUEST/\CRNo charge per Darryl on 3/23/2026.,"TO MEET WITH TRANE-PER CARLOS REQUEST/\CR3/13\CRMet with Trane, having issues with controller can not get to run on its own. Carlos will let us know how t"
McArthur Golf Club,1904,i1830,2026-03-18 12:00 AM,2026-04-17 12:00 AM,278.55,278.55,OVERDUE,Paid BIG UNIT/\CRPaid ck #19083 on 04/08/2026 part of amount $2436.20.,"BIG UNIT/\CR3/17\CRUnit does run low suction, but due to low ambient and condenser fan motors running at 100%. Recommend to install fan cycle control on o"
McArthur Golf Club,1923,i1837,2026-03-20 12:00 AM,2026-04-19 12:00 AM,1127.00,1127.00,OVERDUE,Paid DINING AREA-SMALL UNIT/$1127.00\CRNeed to replace bad EEV and EEV stepper motor to restore operation for this area.\CRPaid ck #19083 on 04/08/2026 pa,"DINING AREA-SMALL UNIT/\CRRepaced a faulty EEV with harness. System is working properly, at this time."
McArthur Golf Club,1900,i1840,2026-03-17 12:00 AM,2026-04-16 12:00 AM,0.00,0.00,NON-BILLABLE,DINING AREA-SMALL UNIT-COIL WAS FROZEN/\CRCarlos said to return tomorrow morning. \CRRobert Stapleton found during maintenance.\CRNo charge per Darryl on 03,"DINING AREA-SMALL UNIT-COIL WAS FROZEN/\CRChecked system. Found system off, a 3.2amp fuse burned. Replaced with a 5-amp fuse. System started, added 2 lb"
McArthur Golf Club,1935,i1856,2026-03-25 12:00 AM,2026-04-24 12:00 AM,375.15,375.15,OVERDUE,Paid EAST COURSE MAINTENANCE-ICE MACHINE-NOT WORKING/\CRJimmy placed call.\CRPaid ck #19083 on 04/08/2026 part of amount $2436.20.,"EAST COURSE MAINTENANCE-ICE MACHINE-NOT WORKING/\CRCheck ice machine found or in that valve. With poor water flow. Picked up and replaced valve.\CRAlso, f"
McArthur Golf Club,1701,i1879,2026-03-30 12:00 AM,2026-04-29 12:00 AM,0.00,0.00,NON-BILLABLE,REFRIGERATION SERVICE FOR JANUARY 2026/\CRRefrigeration Service,REFRIGERATION SERVICE FOR JANUARY 2026/\CR2/9\CRStarted refrigeration maintenance on Back yard. Have to return.\CRCompleted refrigeration maintenance.
McArthur Golf Club,1947,i1880,2026-03-31 12:00 AM,2026-04-30 12:00 AM,0.00,0.00,NON-BILLABLE,EAST COURSE-ICE MACHINE-NOT WORKING/\CRCarlos placed the call/Monday is fine.,"EAST COURSE-ICE MACHINE-NOT WORKING/\CRIce machine now producing ice, due to stuck in thaw mode. Adjusted thickness control. Checked back on machine whi"
McArthur Golf Club,1965,i1889,2026-04-01 12:00 AM,2026-05-01 12:00 AM,2940.00,2940.00,OVERDUE,Paid Labor Maintenance Agreement monthly invoice.\CRPaid ck#19113 on 04/14/2026.,Labor Maintenance Agreement monthly invoice.
McArthur Golf Club,1979,i1907,2026-04-02 12:00 AM,2026-05-02 12:00 AM,0.00,0.00,NON-BILLABLE,BIG UNIT IN THE BASEMENT-LEAKING WATER/\CRCarlos placed the service call.,"BIG UNIT IN THE BASEMENT-LEAKING WATER/\CR4/2/2026\CRFound ball valve not connected to drain line, which was causing the water to drip. Applied glue to dr"
McArthur Golf Club,2005,i1949,2026-04-27 12:00 AM,2026-05-27 12:00 AM,0.00,0.00,NON-BILLABLE,REFRIGERATION AND VENTILATION MAINTENANCE FOR APRIL 2026/\CRRefrigeration Service 18 hrs and Ventilation Service 6,Need to finish up the ventilation \CRREFRIGERATION AND VENTILATION MAINTENANCE FOR APRIL 2026/\CRRefrigeration completed by Jim. \CR4/20\CRCompleted refrigera
McArthur Golf Club,2044,i1962,2026-04-24 12:00 AM,2026-05-24 12:00 AM,0.00,0.00,NON-BILLABLE,EAST MAINTENANCE AREA-ICE MACHINE-NOT WORKING/\CRCarlos placed the call.,"EAST MAINTENANCE AREA-ICE MACHINE-NOT WORKING/\CRCheck ice machine east golf maintenance. Found compressor not running, due to no power coming out of th"
McArthur Golf Club,2089,i1993,2026-05-01 12:00 AM,2026-05-31 12:00 AM,2940.00,2940.00,OVERDUE,Paid Labor Maintenance Agreement monthly invoice.\CRPaid ck #19273 on 5/11/2026.,Labor Maintenance Agreement monthly invoice.
McArthur Golf Club,2107,i2007,2026-06-09 12:00 AM,2026-07-09 12:00 AM,0.00,0.00,NON-BILLABLE,ICE MACHINE AND FILTER CHANGE FOR MAY 2026/\CRIce Machine Service and Filter Change Service,ICE MACHINE AND FILTER CHANGE FOR MAY 2026/\CRCompleted ice machine maintenance by Jim.\CRCompleted filter change by Gabriel.
McArthur Golf Club,2143,i2035,2026-06-02 12:00 AM,2026-07-02 12:00 AM,3825.00,3825.00,OVERDUE,"FIELD HOUSE CONDENSER/\CRNeed to replace condenser coil, drier, and refrigerant. Vacuum and recharge system.","FIELD HOUSE CONDENSER/\CRReplaced condenser coil, drier, and refrigerant. Vacuumed and recharged system. Checked operation, all working normal."
McArthur Golf Club,2222,i2107,2026-06-01 12:00 AM,2026-07-01 12:00 AM,2940.00,2940.00,OVERDUE,Paid Labor Maintenance Agreement monthly invoice.\CRPaid ck #19444 on 06/23/2026.,Labor Maintenance Agreement monthly invoice.
McArthur Golf Club,2280,i2168,2026-06-10 12:00 AM,2026-07-10 12:00 AM,0.00,0.00,NON-BILLABLE,FIELD HOUSE AREA-UNIT MAKING NOISE/\CRCarlos said tomorrow first thing is fine.,FIELD HOUSE AREA-UNIT MAKING NOISE/\CR6/10\CRFound noise coming from Circuit A compressor. Something broke internally. Need to replace. Quote to follow.
McArthur Golf Club,2308,i2182,2026-06-18 12:00 AM,2026-07-18 12:00 AM,1187.21,1187.21,OVERDUE,FIELD HOUSE-REPLACE COMPRESSOR/,"FIELD HOUSE-REPLACE COMPRESSOR\CRReplaced first stage compressor on Trane Morganizer. Checked operation, all working normal at this time. \CRRefrigerant s"
McArthur Golf Club,2334,i2207,2026-07-02 12:00 AM,2026-08-01 12:00 AM,164.72,164.72,DUE,INDEPTH A/C MAINTENANCE FOR JUNE 2026/\CR\CR,"INDEPTH A/C MAINTENANCE FOR JUNE 2026/\CRMaintenance completed by Robert/Sammy. \CRCleared drain lines, cleaned drain pans, changed filters, and checked a"
McArthur Golf Club,2362,i2234,2026-06-29 12:00 AM,2026-07-29 12:00 AM,0.00,0.00,NON-BILLABLE,ELEVATOR AREA-MINI SPLIT-LEAKING WATER/,"ELEVATOR AREA-MINI SPLIT-LEAKING WATER/\CRCheck mini split for the elevator room. Leaking water. Disassembled unit, cleaned the drain pan and the drain"
McArthur Golf Club,2387,i2246,2026-07-01 12:00 AM,2026-07-31 12:00 AM,2940.00,2940.00,DUE,Labor Maintenance Agreement monthly invoice.,Labor Maintenance Agreement monthly invoice.
McArthur Golf Club,2399,i2292,2026-07-16 12:00 AM,2026-08-15 12:00 AM,895.68,895.68,DUE,all parts are in per Eric/not sure of the billing on this???????? DARRYL TO HELP!!!!! Not sure if this was quoted???? \CRNeed to do the job keep open \CRM,"MAIN CLUB-GLYCOL SYSTEM FOR BEVERAGES-NOT WORKING/\CR7/6\CRFound unit low on refrigerant. \CRNeed two king valves.\CR7/15\CRInstalled new service valves, start"
McArthur Golf Club,2454,i2337,2026-07-14 12:00 AM,2026-08-13 12:00 AM,61.60,61.60,DUE,DINING AREA-CLOGGED DRAIN/ \CRChris called Darryl direct.,"DINING AREA-CLOGGED DRAIN/\CRChecked AHU ( above printer) emergency pan overflow, Christ said he vacuum water out. Checked system. SS3 flow switch appar"
Monakee Chad,1314,i1283,2025-10-07 12:00 AM,2025-11-06 12:00 AM,0.00,0.00,NON-BILLABLE,2.5 TON UNIT-WATER LEAK PROBLEM/,2.5 TON UNIT-WATER LEAK PROBLEM/\CRRehung air handler and repaired fittings on drain line. \CRNo charge per Rob on 10/8/2025.
Monakee Chad,1331,i1306,2025-10-14 12:00 AM,2025-11-13 12:00 AM,356.94,356.94,OVERDUE,Paid MAIN UNIT-FROOZE OVER THE WEEKEND-NOT COOLING/ Please call when on the way (561) 818-5817\CRPaid by Zelle to Robert and Robert wrote ck #5611 on 10,"MAIN UNIT- found unit low on refrigerant. Performed leak search on condenser and air handler, could not find leak at this time. Added 6 lbs. of refrig"
"""Mroz, Paul""",1162,i1138,2025-08-16 12:00 AM,2025-09-15 12:00 AM,88.11,88.11,OVERDUE,Paid A/C-NO COOL/\CRPaid ck # 373 on 8/28/2025.,"A/C-NO COOL/\CRFound condenser not running. Found bad dual run cap. Replaced with individual caps and restarted. Also, added caps to shrader valves. Sys"
"""Mroz, Paul""",1355,i1321,2026-01-09 12:00 AM,2026-02-08 12:00 AM,5860.00,5860.00,OVERDUE,"Paid 1- Mitsubishi 1.5-ton ductless mini split heat pump system.  Rated at 19.0 SEER2 @ 18,000 BTU /hr.\CR(MUZ-HM18NA-U2 condenser with a MSZ-HM18NA-U1","GARAGE AREA-1- MITSUBISHI 1.5-TON DUCTLESS MINI SPLIT HEAT PUMP SYSTEM/\CRThis price includes: permit fees, energy calcs, manual J heat load calcs, and"
"""Mroz, Paul""",1770,i1737,2026-02-25 12:00 AM,2026-03-27 12:00 AM,397.50,397.50,OVERDUE,Paid BEDROOM AREA-UNIT IS RUNNING CONTINUOUSLY/\CRPaid ck #221 on 03/26/2026.,BEDROOM AREA-UNIT IS RUNNING CONTINUOUSLY/\CR2/16/2026\CRChecked system. Found a bad control board in the air handler unit and a bad thermostat. Bypassed
"""Muller, Deborah""",2323,i2197,2026-06-25 12:00 AM,2026-07-25 12:00 AM,14080.64,14080.64,DUE,Paid MASTER WING A/C/ emailed her with the amount due for Thursday/Rob picking up the check..... \CR1- Lennox 3ton variable output air conditioning syst,MASTER WING A/C/\CRRemove & dispose of the existing equipment for the south master wing area. Install the above-mentioned air conditioning equipment. Pr
"""Muller, Deborah""",2364,i2250,2026-07-02 12:00 AM,2026-08-01 12:00 AM,2200.00,2200.00,DUE,Paid INSTALL DEHUMIDIFIER FOR GARAGE AREA/$2200.00\CRPaid ck#4278 on 07/02/2026 part of amount $9096.64.,INSTALL DEHUMIDIFIER FOR GARAGE AREA/\CRInstalled dehumidifier and drain line at this time. Unit is working.
"""Muller, Deborah""",2363,i2252,2026-07-02 12:00 AM,2026-08-01 12:00 AM,0.00,0.00,NON-BILLABLE,REINSTALLING MASTER THERMOSTAT FOR GUEST WING AND INSTALL UV LIGHT IN MASTER AIR HANDLER/\CR,REINSTALLING MASTER THERMOSTAT FOR GUEST WING AND INSTALL UV LIGHT IN MASTER AIR HANDLER/\CRInstalled new UV light for master system air handler. Reinst
Musselman Residence,2286,i2206,2026-06-10 12:00 AM,2026-07-10 12:00 AM,0.00,0.00,NON-BILLABLE,UNIT RUNNING CONTINOUSLY-68 DEG IN THE SPACE/\CRNo Charge per Rob.,UNIT RUNNING CONTINOUSLY-68 DEG IN THE SPACE/\CRChecked unit. Found a faulty damper module. Quote to follow. \CR\CR\CR
Musselman Residence,2342,i2215,2026-07-09 12:00 AM,2026-08-08 12:00 AM,1407.00,1407.00,DUE,Gabriel has parts picked up on 7/1/2026\CRMAIN A/C/$1407.00\CRNeed to call Roberto as soon part comes in. \CRReplace defective Honeywell damper control boar,"MAIN A/C/\CR7/9/2026\CRReplaced bad damper module, after replacing module, found that the 2nd floor thermostat was burned, spoke to Roberto and he authori"
"""Narr, David & Amanda""",1050,i1038,2025-07-30 12:00 AM,2025-08-29 12:00 AM,12316.00,0.00,PAID,"Paid REPLACEMENT OF UNIT/$12,316.00\CRLennox EL 18KCV 3-ton communicating, variable a/c system.\CRPaid ck #1081 on 7/25/2025.","REPLACEMENT OF UNIT/$12,316.00\CRLennox EL 18KCV 3-ton communicating, variable a/c system."
"""Narr, George & Christine""",1317,i1282,2025-10-21 12:00 AM,2025-11-20 12:00 AM,948.00,948.00,OVERDUE,PAID MAIN A/C-INSTALLATION OF REME HALO/$948.00\CRCHECK # 102 10/20/2025,MAIN A/C/\CRInstalled Reme Halo in Main System.
"""Narr, George & Christine""",1662,i1625,2026-01-21 12:00 AM,2026-02-20 12:00 AM,0.00,0.00,NON-BILLABLE,Conf with Mr. Narr on 1/15/2026 for 1/21/2026.\CRREPLACE THE REMI HALO UNDER WARRANTY/,"REPLACE THE REMI HALO UNDER WARRANTY/\CRReplaced Remi Hallo, still having a problem. Need to return with a new one. \CRInstalled a new Remi-Halo."
"""Narr, George & Christine - 1008""",1372,i1335,2025-10-21 12:00 AM,2025-11-20 12:00 AM,4495.50,4495.50,OVERDUE,PAID INSTALL DEPOSIT FOR PATIO 1.5 TON SPLIT SYSTEM.\CRCHECK # 102 10/20/2025 $4495.50,COLLECTED 50% DEPOSIT FOR PATIO 1.5 TON SPLIT SYSTEM INSTALL.
"""Narr, George & Christine - 1008""",1793,i1725,2026-06-09 12:00 AM,2026-07-09 12:00 AM,5664.00,5664.00,OVERDUE,"Paid SUNROOM/PATIO AREA/\CR1- Lennox 1.5ton heat pump air conditioning system.  Rated at a 15.20 SEER2 @ 18,000 BTU /hr.\CR(ML14KP1-018 condensing unit wi",SUN ROOM/PATIO AREA/
"""Navarro, Jose & Rosa""",1570,i1524,2025-12-18 12:00 AM,2026-01-17 12:00 AM,65.00,65.00,OVERDUE,Paid INDEPTH A/C MAINTENANCE FOR DECEMBER 2025/\CRPaid ck# 1309 on 1/23/2026,"INDEPTH A/C MAINTENANCE FOR DECEMBER 2025/\CRMaintenance completed, unit is working at this time."
"""Navarro, Jose & Rosa""",2329,i2209,2026-06-22 12:00 AM,2026-07-22 12:00 AM,75.00,75.00,DUE,Paid CHECK A/C SYSTEM/\CRPaid ck #1310 on 7/16/2026.,"CHECK A/C SYSTEM/\CRChecked system everithing look right, we check the split temperature and we have the 20 degrees TD, the coil, drain pan and drain ar"
"""Navarro, Wilfredo""",1571,i1525,2025-12-18 12:00 AM,2026-01-17 12:00 AM,85.00,85.00,OVERDUE,Paid INDEPTH A/C MAINTENANCE FOR DECEMBER 2025/\CRPaid ck# 108 on 1/23/2026,"INDEPTH A/C MAINTENANCE FOR DECEMBER 2025/\CRMaintenance completed, unit is working at this time. \CRReplaced capacitor. \CR\CR"
"""Navarro, Wilfredo""",2348,i2218,2026-06-23 12:00 AM,2026-07-23 12:00 AM,75.00,75.00,DUE,Paid A/C-LEAKING WATER/\CRPaid ck #119 on 07/16/2026 part of amount $370.00.,"A/C-LEAKING WATER/\CRFound unit filled with algae and drain line as well, vacuumed it out and also cleaned the pan as well. Saw the side of the drain pa"
Nicholl Ramon & Sheree,1265,i1267,2025-10-01 12:00 AM,2025-10-31 12:00 AM,0.00,0.00,NON-BILLABLE,Confirmed via email on 9/23/2025-please call when on the way (561) 706-2629. \CRNEED TO PERFORM A MAINTENANCE. \CR,1ST MAINTENANCE PERFORMED/\CRChecked all units. Cleared drain lines and cleaned drain pans. Replaced all filters. Checked all electrical components. All
Nicholl Ramon & Sheree,1556,i1512,2025-12-16 12:00 AM,2026-01-15 12:00 AM,385.00,385.00,OVERDUE,Paid MASTER BEDROOM-A/C NOT COOLING PROPERLY/\CRPaid ck#1198 on 1/7/2026.\CR,"MASTER BEDROOM AIR HANDLER/\CRUpon arriving saw that thermostat was calling for cool, but nothing was working, checked the air handler and found the blo"
Nicholl Ramon & Sheree,1586,i1533,2025-12-23 12:00 AM,2026-01-22 12:00 AM,345.08,345.08,OVERDUE,Paid VERTICAL SYSTEM IN GARAGE CLOSET-BLANK THERMOSTAT GUEST BEDROOM AREA/\CRPaid ck# 1242 on 1/9/2026.,VERTICAL SYSTEM IN GARAGE CLOSET-BLANK/\CR1st FLOOR GUEST BEDROOM AREA- Found thermostat would not respond to any commands. Replaced  a Honeywell Digita
Nicholl Ramon & Sheree,1619,i1567,2026-01-05 12:00 AM,2026-02-04 12:00 AM,725.00,725.00,OVERDUE,Paid Conf with Chris via text on 1/2 for 1/5/2026 at 9 am give or take.  \CRMAIN LIVING AREA-NO HEAT/Need to call Chris when on the way 561) 706-2629\CRCh,"MAIN LIVING AREA-NO HEAT/\CR1/2\CRFound fusible links open. Recommend to replace 10kw heat strip. \CR1/6\CRReplaced 10KW heater, heat is working at this time."
Nicholl Ramon & Sheree,1730,i1674,2026-02-04 12:00 AM,2026-03-06 12:00 AM,650.00,650.00,OVERDUE,Paid Planned Service Agreement Yearly Invoice. \CR4-Systems\CRPaid ck #1029 on 2/12/2026.,Planned Service Agreement Yearly Invoice. \CR4-Systems
Nicholl Ramon & Sheree,1769,i1709,2026-02-16 12:00 AM,2026-03-18 12:00 AM,95.00,95.00,OVERDUE,Paid LIVING AREA/POOL TABLE ROOM-UNIT NOT WORKING/\CRPaid ck #3631 on 03/12/2026.,"LIVING AREA/POOL TABLE ROOM-UNIT NOT COOLING/ \CRFound system had no power. Checked for any grounded wires, or any burnt wires, didn’t find any. Checked"
Nicholl Ramon & Sheree,1807,i1746,2026-02-25 12:00 AM,2026-03-27 12:00 AM,0.00,0.00,NON-BILLABLE,MAIN UNIT-BREAKER TRIPPED/\CRChris placed the call.\CRNo charge per Rob 03/02/2026.,"MAIN UNIT/\CRUpon arriving, found that the main breaker was tripped, turn it back on check amps and got 42 on it out of a 60 amp breaker, heater is work"
Nicholl Ramon & Sheree,1983,i1904,2026-04-08 12:00 AM,2026-05-08 12:00 AM,0.00,0.00,NON-BILLABLE,INDEPTH A/C MAINTENANCE FOR APRIL 2026/\CR4-systems,"INDEPTH A/C MAINTENANCE FOR APRIL 2026/\CRCompleted maintenance by Pablo. \CRMaintenance completed. Units are working at this time, vacuumed drain lines,"
Nicholl Ramon & Sheree,2430,i2296,2026-07-09 12:00 AM,2026-08-08 12:00 AM,0.00,0.00,NON-BILLABLE,UPSTAIRS SYSTEM-HAS A FULL DRAIN PAN/,"UPSTAIRS SYSTEM-HAS A FULL DRAIN PAN/\CRFound drain line clogged a bit but enough to shut it down and drip into the emergency pan, vacuumed drain line s"
Old Palm Golf Club,1804,i1745,2026-02-25 12:00 AM,2026-03-27 12:00 AM,462.50,462.50,OVERDUE,Paid KITCHEN EXHAUST FAN-NOT ENOUGH AIR FLOW/\CRPaid Ck#76399 on 3/26/2026.,KITCHEN EXHAUST FAN/\CRKitchen exhaust fan-not enough air flow. Checked operation of hoods 1 and 2. Both were running and moving a good amount of air. F
Old Palm Golf Club,1812,i1748,2026-03-16 12:00 AM,2026-04-15 12:00 AM,2148.72,2148.72,OVERDUE,"Paid EXHAUST FAN #1 AND EXHAUST FAN #2/$2148.72\CRNeed to replace motor, pulley, and belts on Ex. #2/ Replace belts on Ex. #1 for Main Kitchen.\CRPaid ck",EXHAUST FAN #1 AND EXHAUST FAN #2/\CR3/16\CRInstalled new exhaust motor and pulley on Exhaust #2. Adjust too 4.9 R 5.4. Fan is Maxed at its full load pote
Old Palm Golf Club,1858,i1795,2026-03-06 12:00 AM,2026-04-05 12:00 AM,370.00,370.00,OVERDUE,Paid MAIN KITCHEN-WALK IN COOLER READING 50 DEG/\CRPaul called Darryl with the service call.\CRPaid ck #76606 on 04/08/2026.,MAIN KITCHEN-WALK IN COOLER READING 50 DEG/\CR3/6\CRUnit low on refrigerant. Leak checked could not pin point. Equipment in very poor condition R-22. Othe
Old Palm Golf Club,1887,i1839,2026-03-16 12:00 AM,2026-04-15 12:00 AM,370.00,370.00,OVERDUE,Paid WALK IN COOLER-NEED TO LEAK SEARCH/\CRPaul approved.\CRPaid ck #76715 on 04/14/2026 part of amount $2518.72.,WALK IN COOLER-NEED TO LEAK SEARCH/\CR3/16\CRLeak checked system found leak in evaporator. Need replacement. Quote to follow.
Ortiz Iris -3064,1572,i1526,2025-12-18 12:00 AM,2026-01-17 12:00 AM,189.81,189.81,OVERDUE,Paid INDEPTH A/C MAINTENANCE FOR DECEMBER 2025/\CRPaid ck # 107 on 1/15/2026 part of amount $1125.22,"INDEPTH A/C MAINTENANCE FOR DECEMBER 2025/\CRMaintenance completed, unit is working at this time.\CRFound unit low on freon did a leak search and found th"
Ortiz Iris -3064,1589,i1537,2025-12-24 12:00 AM,2026-01-23 12:00 AM,935.41,935.41,OVERDUE,Paid MAIN HOUSE 3 TON SPLIT SYSTEM/\CRInstall customer supplied Lennox 3-ton split system.\CRPaid ck # 107 on 1/15/2026 part of amount $1125.22\CR,MAIN HOUSE 3 TON SPLIT SYSTEM/\CRInstalled customer supplied Lennox system.
Ortiz Iris -3064,1693,i1647,2026-01-28 12:00 AM,2026-02-27 12:00 AM,0.00,0.00,NON-BILLABLE,A/C UNIT-NOT COOLING/,"A/C UNIT-NOT COOLING/\CR1/26/26\CRFound unit frozen, turned the system off and left fan ""ON"". To defrost. \CRChecked system, TXV is not regulating well caus"
Ortiz Iris -3064,1795,i1732,2026-02-23 12:00 AM,2026-03-25 12:00 AM,0.00,0.00,NON-BILLABLE,A/C NOT COOLING/,"A/C NOT COOLING/\CRFound half of the evaporator coil frozen. Melted ice with water. System was full of charge, performed leak search didn’t found any le"
Pakradooni Michael,1815,i1751,2026-02-26 12:00 AM,2026-03-28 12:00 AM,0.00,0.00,NON-BILLABLE,ALSO WANTS THE DRYER VENT TO BE CLEANED.......\CRINDEPTH A/C MAINTENANCE FOR MARCH 2026/1ST MAINTENANCE \CRConf with Michael on 02/20/2026 for 02/26/2026-,INDEPTH A/C MAINTENANCE FOR MARCH 2026/1ST MAINTENANCE/ \CR2/26\CRServiced both A/C and wine room. Needs filter and UV lights. Also cleaned dryer vent. \CRP
Pakradooni Michael,1825,i1760,2026-03-02 12:00 AM,2026-04-01 12:00 AM,900.00,900.00,OVERDUE,Paid Planned Service Agreement Yearly Invoice. \CR2-Units\CRPaid ck #0000005383 on 3/4/2026,Planned Service Agreement Yearly Invoice. \CR2-Units
Pakradooni Michael,1902,i1826,2026-03-17 12:00 AM,2026-04-16 12:00 AM,702.18,702.18,OVERDUE,Paid REPAIR DUCT/PLENUM/\CRPaid ck #0000005393 on 04/08/2026.,REPAIR DUCT/PLENUM/\CRReplaced UV cell assemble and Remi Halo unit. Replaced deteriorated supply duct section. Sealed with mastic to prevent any attic l
Pakradooni Michael,2266,i2212,2026-06-23 12:00 AM,2026-07-23 12:00 AM,0.00,0.00,NON-BILLABLE,INDEPTH A/C MAINTENANCE FOR JUNE 2026/\CR2-units  \CR,INDEPTH A/C MAINTENANCE FOR JUNE 2026/\CRMaintenance completed by Pablo/Ritter/Jim. \CRMaintenance completed unit is working at this time. Found the drain
"""Pakradooni, Kathryn""",2151,i2041,2026-05-14 12:00 AM,2026-06-13 12:00 AM,400.00,400.00,OVERDUE,Planned Service Agreement Yearly Invoice. \CR1-Unit,Planned Service Agreement Yearly Invoice. \CR1-Unit
"""Pakradooni, Kathryn""",2147,i2042,2026-05-14 12:00 AM,2026-06-13 12:00 AM,53.00,53.00,OVERDUE,INDEPTH A/C MAINTENANCE FOR May 2026/\CR1- unit,"INDEPTH A/C MAINTENANCE FOR May 2026/\CRMaintenance completed by Gabriel. \CRCleared drain line, cleaned drain pan, changed filter, and checked all electr"
Panattoni Carl and Mary,1011,i1220,2025-11-19 12:00 AM,2025-12-19 12:00 AM,3933.50,3933.50,OVERDUE,Paid FINAL BILLING/\CRINSTALLATION OF 3 WINE ROOM REFRIGERATION EQUIPMENT/ \CRPaid ck#010820 on 02/02/2026.\CR\CR,INSTALLATION OF 3 WINE ROOM REFRIGERATION EQUIPMENT/ \CR10% Remaining balance of original job: $2533.50 plus additional extras. \CR\CR
Panattoni Carl and Mary,1958,i1902,2026-03-31 12:00 AM,2026-04-30 12:00 AM,0.00,0.00,NON-BILLABLE,INDEPTH REFRIGERATION MAINTENANCE FOR APRIL 2026/,INDEPTH REFRIGERATION MAINTENANCE FOR APRIL 2026/\CRThis was the first maintenance on the service agreement/see work order #1984 for the actual maintena
Panattoni Carl and Mary,1984,i1905,2026-03-31 12:00 AM,2026-04-30 12:00 AM,0.00,0.00,NON-BILLABLE,INDEPTH REFRIGERATION MAINTENANCE FOR APRIL 2026/\CR3LRC/Copeland refrigeration systems for the 3 wine storage closets.,INDEPTH REFRIGERATION MAINTENANCE FOR APRIL 2026/\CRMaintenance was completed on work order #1958.
Panattoni Carl and Mary,1988,i1908,2026-04-06 12:00 AM,2026-05-06 12:00 AM,1200.00,1200.00,OVERDUE,Paid Planned Service Agreement Yearly Invoice. \CR3LRC/Copeland refrigeration systems for the 3 wine storage closets.\CRPaid ACH on 4/14/2026.,Planned Service Agreement Yearly Invoice. \CR3LRC/Copeland refrigeration systems for the 3 wine storage closets.
Panattoni Carl and Mary,2408,i2269,2026-07-21 12:00 AM,2026-08-20 12:00 AM,0.00,0.00,NON-BILLABLE,NEED TO COMPLETE THE MAITNENANCE AND BRING BACK 2-18X20X2 AND ROBERT HAS TO PROGRAM THE THERMOSTAT SO JOE CAN SEE THEM ON HIS PHONE...... Joe will cal,"INDEPTH REFRIGERATION MAINTENANCE FOR JULY 2026/\CR7/21\CRServiced all wine rooms. Check operation, all running normal box temps maintaining 54. Need to r"
"""Pelletier, Michael""",2130,i2043,2026-05-14 12:00 AM,2026-06-13 12:00 AM,165.00,165.00,OVERDUE,"Paid NEED TO PERFORM MAINTENANCE-1 UNIT/\CRCC: 4121-3831-0638-8958-Exp: 11/29, Code: 473\CRPaid cc on 05/19/2026. \CR\CR","MAINTENANCE PERFORMED/\CRFilter size: 1- FP1-16.5x21.5\CRMaintenance completed. Evaporator coil was a little dirty, cleaned with water and evaporator coil"
"""Perry , Matthew & Catherine""",1338,i1302,2025-10-14 12:00 AM,2025-11-13 12:00 AM,422.08,422.08,OVERDUE,Paid WATER KEEPS COMING OUT AND SHE KEEPS EMPTYING IT OUT/\CROn 2/3/2026-added $150.00 to orig invoice that was $247.08 for total of $422.08.\CRPaid by cc,WATER KEEPS COMING OUT AND SHE KEEPS EMPTYING IT OUT/\CRFound drain line plugging up with algae. Drain line runs under slab of house. Drain from AHU to
"""Perry , Matthew & Catherine""",1725,i1666,2026-02-03 12:00 AM,2026-03-05 12:00 AM,167.76,167.76,OVERDUE,"Paid NO HEAT/\CRMrs. P placed the call.\CROrig call $247.08, plus the maintenance $175.00, plus today's service call $167.76 total $589.84\CRPaid by cc on 2","MAIN SYSTEM NO HEAT/\CRChecked heat operation found bad contactor. Replaced failed contactor, turned on heat working normal at this time."
